Sheet: Tabelle1
A1: Rank | B1: State | C1: Population as of 1980 census | D1: Population as of 1970 census | E1: Change | F1: Percent change | H1: of:=[.B1] -> State | I1: population1980
A2: 1 | B2: California | C2: 23,667,902 | D2: 19,953,134 | E2: 3,714,768 | F2: 18.6% | H2: of:=[.B2] -> California | I2: of:=[.C2] -> 23,667,902
A3: 2 | B3: New York | C3: 17,558,072 | D3: 18,236,967 | E3: –678,895 | F3: –3.7% | H3: of:=[.B3] -> New York | I3: of:=[.C3] -> 17,558,072
A4: 3 | B4: Texas | C4: 14,229,191 | D4: 11,196,730 | E4: 3,032,461 | F4: 27.1% | H4: of:=[.B4] -> Texas | I4: of:=[.C4] -> 14,229,191
A5: 4 | B5: Pennsylvania | C5: 11,863,895 | D5: 11,793,909 | E5: 69.986 | F5: 0.6% | H5: of:=[.B5] -> Pennsylvania | I5: of:=[.C5] -> 11,863,895
A6: 5 | B6: Illinois | C6: 11,426,518 | D6: 11,113,976 | E6: 312.542 | F6: 2.8% | H6: of:=[.B6] -> Illinois | I6: of:=[.C6] -> 11,426,518
A7: 6 | B7: Ohio | C7: 10,797,630 | D7: 10,652,017 | E7: 145.613 | F7: 1.4% | H7: of:=[.B7] -> Ohio | I7: of:=[.C7] -> 10,797,630
A8: 7 | B8: Florida | C8: 9,746,324 | D8: 6,789,443 | E8: 2,956,881 | F8: 43.6% | H8: of:=[.B8] -> Florida | I8: of:=[.C8] -> 9,746,324
A9: 8 | B9: Michigan | C9: 9,262,078 | D9: 8,875,083 | E9: 386.995 | F9: 4.4% | H9: of:=[.B9] -> Michigan | I9: of:=[.C9] -> 9,262,078
A10: 9 | B10: New Jersey | C10: 7,364,823 | D10: 7,168,164 | E10: 196.659 | F10: 2.7% | H10: of:=[.B10] -> New Jersey | I10: of:=[.C10] -> 7,364,823
A11: 10 | B11: North Carolina | C11: 5,881,766 | D11: 5,082,059 | E11: 799.707 | F11: 15.7% | H11: of:=[.B11] -> North Carolina | I11: of:=[.C11] -> 5,881,766
A12: 11 | B12: Massachusetts | C12: 5,737,037 | D12: 5,689,170 | E12: 47.867 | F12: 0.8% | H12: of:=[.B12] -> Massachusetts | I12: of:=[.C12] -> 5,737,037
A13: 12 | B13: Indiana | C13: 5,490,224 | D13: 5,193,669 | E13: 296.555 | F13: 5.7% | H13: of:=[.B13] -> Indiana | I13: of:=[.C13] -> 5,490,224
A14: 13 | B14: Georgia | C14: 5,463,105 | D14: 4,589,575 | E14: 873.53 | F14: 19.0% | H14: of:=[.B14] -> Georgia | I14: of:=[.C14] -> 5,463,105
A15: 14 | B15: Virginia | C15: 5,346,818 | D15: 4,668,494 | E15: 678.324 | F15: 15.0% | H15: of:=[.B15] -> Virginia | I15: of:=[.C15] -> 5,346,818
A16: 15 | B16: Missouri | C16: 4,916,686 | D16: 4,676,501 | E16: 240.185 | F16: 8.3% | H16: of:=[.B16] -> Missouri | I16: of:=[.C16] -> 4,916,686
A17: 16 | B17: Wisconsin | C17: 4,705,767 | D17: 4,417,731 | E17: 288.036 | F17: 6.5% | H17: of:=[.B17] -> Wisconsin | I17: of:=[.C17] -> 4,705,767
A18: 17 | B18: Tennessee | C18: 4,591,120 | D18: 3,923,687 | E18: 667.443 | F18: 17.0% | H18: of:=[.B18] -> Tennessee | I18: of:=[.C18] -> 4,591,120
A19: 18 | B19: Maryland | C19: 4,216,975 | D19: 3,922,399 | E19: 294.576 | F19: 7.5% | H19: of:=[.B19] -> Maryland | I19: of:=[.C19] -> 4,216,975
A20: 19 | B20: Louisiana | C20: 4,205,900 | D20: 3,641,306 | E20: 564.594 | F20: 15.5% | H20: of:=[.B20] -> Louisiana | I20: of:=[.C20] -> 4,205,900
A21: 20 | B21: Washington | C21: 4,132,156 | D21: 3,409,169 | E21: 722.987 | F21: 21.2% | H21: of:=[.B21] -> Washington | I21: of:=[.C21] -> 4,132,156
A22: 21 | B22: Minnesota | C22: 4,075,970 | D22: 3,804,971 | E22: 270.999 | F22: 7.1% | H22: of:=[.B22] -> Minnesota | I22: of:=[.C22] -> 4,075,970
A23: 22 | B23: Alabama | C23: 3,893,888 | D23: 3,444,165 | E23: 449.723 | F23: 13.1% | H23: of:=[.B23] -> Alabama | I23: of:=[.C23] -> 3,893,888
A24: 23 | B24: Kentucky | C24: 3,660,777 | D24: 3,218,706 | E24: 442.071 | F24: 13.7% | H24: of:=[.B24] -> Kentucky | I24: of:=[.C24] -> 3,660,777
A25: 24 | B25: South Carolina | C25: 3,121,820 | D25: 2,590,516 | E25: 531.304 | F25: 20.5% | H25: of:=[.B25] -> South Carolina | I25: of:=[.C25] -> 3,121,820
A26: 25 | B26: Connecticut | C26: 3,107,576 | D26: 3,031,709 | E26: 75.867 | F26: 2.5% | H26: of:=[.B26] -> Connecticut | I26: of:=[.C26] -> 3,107,576
A27: 26 | B27: Oklahoma | C27: 3,025,290 | D27: 2,559,229 | E27: 466.061 | F27: 18.2% | H27: of:=[.B27] -> Oklahoma | I27: of:=[.C27] -> 3,025,290
A28: 27 | B28: Iowa | C28: 2,913,808 | D28: 2,824,376 | E28: 89.432 | F28: 3.2% | H28: of:=[.B28] -> Iowa | I28: of:=[.C28] -> 2,913,808
A29: 28 | B29: Colorado | C29: 2,889,964 | D29: 2,207,259 | E29: 682.705 | F29: 30.9% | H29: of:=[.B29] -> Colorado | I29: of:=[.C29] -> 2,889,964
A30: 29 | B30: Arizona | C30: 2,718,215 | D30: 1,745,944 | E30: 972.271 | F30: 55.7% | H30: of:=[.B30] -> Arizona | I30: of:=[.C30] -> 2,718,215
A31: 30 | B31: Oregon | C31: 2,633,105 | D31: 2,091,533 | E31: 541.572 | F31: 25.9% | H31: of:=[.B31] -> Oregon | I31: of:=[.C31] -> 2,633,105
A32: 31 | B32: Mississippi | C32: 2,520,638 | D32: 2,216,192 | E32: 304.446 | F32: 13.7% | H32: of:=[.B32] -> Mississippi | I32: of:=[.C32] -> 2,520,638
A33: 32 | B33: Kansas | C33: 2,363,679 | D33: 2,246,578 | E33: 117.101 | F33: 5.2% | H33: of:=[.B33] -> Kansas | I33: of:=[.C33] -> 2,363,679
A34: 33 | B34: Arkansas | C34: 2,286,435 | D34: 1,923,295 | E34: 363.14 | F34: 18.9% | H34: of:=[.B34] -> Arkansas | I34: of:=[.C34] -> 2,286,435
A35: 34 | B35: West Virginia | C35: 1,949,644 | D35: 1,744,237 | E35: 205.407 | F35: 11.8% | H35: of:=[.B35] -> West Virginia | I35: of:=[.C35] -> 1,949,644
A36: 35 | B36: Nebraska | C36: 1,569,825 | D36: 1,483,493 | E36: 86.332 | F36: 5.8% | H36: of:=[.B36] -> Nebraska | I36: of:=[.C36] -> 1,569,825
A37: 36 | B37: Utah | C37: 1,461,037 | D37: 1,059,273 | E37: 401.764 | F37: 37.9% | H37: of:=[.B37] -> Utah | I37: of:=[.C37] -> 1,461,037
A38: 37 | B38: New Mexico | C38: 1,302,894 | D38: 1,017,055 | E38: 285.839 | F38: 28.1% | H38: of:=[.B38] -> New Mexico | I38: of:=[.C38] -> 1,302,894
A39: 38 | B39: Maine | C39: 1,124,660 | D39: 992.048 | E39: 132.612 | F39: 13.4% | H39: of:=[.B39] -> Maine | I39: of:=[.C39] -> 1,124,660
A40: 39 | B40: Hawaii | C40: 964.691 | D40: 769.913 | E40: 194.778 | F40: 25.3% | H40: of:=[.B40] -> Hawaii | I40: of:=[.C40] -> 964.691
A41: 40 | B41: Rhode Island | C41: 947.154 | D41: 946.725 | E41: 429 | F41: 0.0% | H41: of:=[.B41] -> Rhode Island | I41: of:=[.C41] -> 947.154
A42: 41 | B42: Idaho | C42: 943.935 | D42: 712.567 | E42: 231.368 | F42: 32.5% | H42: of:=[.B42] -> Idaho | I42: of:=[.C42] -> 943.935
A43: 42 | B43: New Hampshire | C43: 920.61 | D43: 737.681 | E43: 182.929 | F43: 24.8% | H43: of:=[.B43] -> New Hampshire | I43: of:=[.C43] -> 920.61
A44: 43 | B44: Nevada | C44: 800.493 | D44: 488.738 | E44: 311.755 | F44: 63.8% | H44: of:=[.B44] -> Nevada | I44: of:=[.C44] -> 800.493
A45: 44 | B45: Montana | C45: 786.69 | D45: 694.409 | E45: 92.281 | F45: 13.3% | H45: of:=[.B45] -> Montana | I45: of:=[.C45] -> 786.69
A46: 45 | B46: South Dakota | C46: 690.768 | D46: 665.507 | E46: 25.261 | F46: 3.8% | H46: of:=[.B46] -> South Dakota | I46: of:=[.C46] -> 690.768
A47: 46 | B47: North Dakota | C47: 652.717 | D47: 617.761 | E47: 34.956 | F47: 5.7% | H47: of:=[.B47] -> North Dakota | I47: of:=[.C47] -> 652.717
A48: — | B48: District of Columbia | C48: 638.333 | D48: 756.51 | E48: –118,177 | F48: –15.6% | H48: of:=[.B48] -> District of Columbia | I48: of:=[.C48] -> 638.333
A49: 47 | B49: Delaware | C49: 594.338 | D49: 548.104 | E49: 46.234 | F49: 8.4% | H49: of:=[.B49] -> Delaware | I49: of:=[.C49] -> 594.338
A50: 48 | B50: Vermont | C50: 511.456 | D50: 444.33 | E50: 67.126 | F50: 15.1% | H50: of:=[.B50] -> Vermont | I50: of:=[.C50] -> 511.456
A51: 49 | B51: Wyoming | C51: 469.557 | D51: 332.416 | E51: 137.141 | F51: 41.3% | H51: of:=[.B51] -> Wyoming | I51: of:=[.C51] -> 469.557
A52: 50 | B52: Alaska | C52: 401.851 | D52: 300.382 | E52: 101.469 | F52: 33.8% | H52: of:=[.B52] -> Alaska | I52: of:=[.C52] -> 401.851

Sheet: Tabelle2
A1: of:=[#REF!] -> #REF! | B1: population1980
A2: of:=[#REF!] -> #REF! | B2: of:=[#REF!] -> #REF!
A3: of:=[#REF!] -> #REF! | B3: of:=[#REF!] -> #REF!
A4: of:=[#REF!] -> #REF! | B4: of:=[#REF!] -> #REF!
A5: of:=[#REF!] -> #REF! | B5: of:=[#REF!] -> #REF!
A6: of:=[#REF!] -> #REF! | B6: of:=[#REF!] -> #REF!
A7: of:=[#REF!] -> #REF! | B7: of:=[#REF!] -> #REF!
A8: of:=[#REF!] -> #REF! | B8: of:=[#REF!] -> #REF!
A9: of:=[#REF!] -> #REF! | B9: of:=[#REF!] -> #REF!
A10: of:=[#REF!] -> #REF! | B10: of:=[#REF!] -> #REF!
A11: of:=[#REF!] -> #REF! | B11: of:=[#REF!] -> #REF!
A12: of:=[#REF!] -> #REF! | B12: of:=[#REF!] -> #REF!
A13: of:=[#REF!] -> #REF! | B13: of:=[#REF!] -> #REF!
A14: of:=[#REF!] -> #REF! | B14: of:=[#REF!] -> #REF!
A15: of:=[#REF!] -> #REF! | B15: of:=[#REF!] -> #REF!
A16: of:=[#REF!] -> #REF! | B16: of:=[#REF!] -> #REF!
A17: of:=[#REF!] -> #REF! | B17: of:=[#REF!] -> #REF!
A18: of:=[#REF!] -> #REF! | B18: of:=[#REF!] -> #REF!
A19: of:=[#REF!] -> #REF! | B19: of:=[#REF!] -> #REF!
A20: of:=[#REF!] -> #REF! | B20: of:=[#REF!] -> #REF!
A21: of:=[#REF!] -> #REF! | B21: of:=[#REF!] -> #REF!
A22: of:=[#REF!] -> #REF! | B22: of:=[#REF!] -> #REF!
A23: of:=[#REF!] -> #REF! | B23: of:=[#REF!] -> #REF!
A24: of:=[#REF!] -> #REF! | B24: of:=[#REF!] -> #REF!
A25: of:=[#REF!] -> #REF! | B25: of:=[#REF!] -> #REF!
A26: of:=[#REF!] -> #REF! | B26: of:=[#REF!] -> #REF!
A27: of:=[#REF!] -> #REF! | B27: of:=[#REF!] -> #REF!
A28: of:=[#REF!] -> #REF! | B28: of:=[#REF!] -> #REF!
A29: of:=[#REF!] -> #REF! | B29: of:=[#REF!] -> #REF!
A30: of:=[#REF!] -> #REF! | B30: of:=[#REF!] -> #REF!
A31: of:=[#REF!] -> #REF! | B31: of:=[#REF!] -> #REF!
A32: of:=[#REF!] -> #REF! | B32: of:=[#REF!] -> #REF!
A33: of:=[#REF!] -> #REF! | B33: of:=[#REF!] -> #REF!
A34: of:=[#REF!] -> #REF! | B34: of:=[#REF!] -> #REF!
A35: of:=[#REF!] -> #REF! | B35: of:=[#REF!] -> #REF!
A36: of:=[#REF!] -> #REF! | B36: of:=[#REF!] -> #REF!
A37: of:=[#REF!] -> #REF! | B37: of:=[#REF!] -> #REF!
A38: of:=[#REF!] -> #REF! | B38: of:=[#REF!] -> #REF!
A39: of:=[#REF!] -> #REF! | B39: of:=[#REF!] -> #REF!
A40: of:=[#REF!] -> #REF! | B40: of:=[#REF!] -> #REF!
A41: of:=[#REF!] -> #REF! | B41: of:=[#REF!] -> #REF!
A42: of:=[#REF!] -> #REF! | B42: of:=[#REF!] -> #REF!
A43: of:=[#REF!] -> #REF! | B43: of:=[#REF!] -> #REF!
A44: of:=[#REF!] -> #REF! | B44: of:=[#REF!] -> #REF!
A45: of:=[#REF!] -> #REF! | B45: of:=[#REF!] -> #REF!
A46: of:=[#REF!] -> #REF! | B46: of:=[#REF!] -> #REF!
A47: of:=[#REF!] -> #REF! | B47: of:=[#REF!] -> #REF!
A48: of:=[#REF!] -> #REF! | B48: of:=[#REF!] -> #REF!
A49: of:=[#REF!] -> #REF! | B49: of:=[#REF!] -> #REF!
A50: of:=[#REF!] -> #REF! | B50: of:=[#REF!] -> #REF!
A51: of:=[#REF!] -> #REF! | B51: of:=[#REF!] -> #REF!
A52: of:=[#REF!] -> #REF! | B52: of:=[#REF!] -> #REF!